{
  "$schema": "https://json-schema.org/draft/2020-12/schema",
  "$id": "https://sister.local/contracts/infra/composition/1.0.0/composition.schema.json",
  "title": "SisTer Infra Composition 1.0.0",
  "description": "Declara quais fontes de componentes participam de uma composição concreta, sem declarar identidade duplicada, binding ou qualificação.",
  "type": "object",
  "additionalProperties": false,
  "required": [
    "schema",
    "composition_id",
    "deployment_class",
    "components"
  ],
  "properties": {
    "schema": {
      "const": "sister.infra.composition/1.0.0"
    },
    "composition_id": {
      "type": "string",
      "minLength": 1,
      "pattern": "^[A-Za-z0-9][A-Za-z0-9._-]*$"
    },
    "deployment_class": {
      "const": "workstation"
    },
    "components": {
      "type": "array",
      "minItems": 1,
      "items": {
        "type": "object",
        "additionalProperties": false,
        "required": [
          "source"
        ],
        "properties": {
          "source": {
            "type": "string",
            "minLength": 1
          }
        }
      }
    }
  }
}
